"Item Id","Item URI","Dublin Core:Title","Dublin Core:Subject","Dublin Core:Description","Dublin Core:Creator","Dublin Core:Source","Dublin Core:Publisher","Dublin Core:Date","Dublin Core:Contributor","Dublin Core:Rights","Dublin Core:Relation","Dublin Core:Format","Dublin Core:Language","Dublin Core:Type","Dublin Core:Identifier","Dublin Core:Coverage","Item Type Metadata:Text","Item Type Metadata:Transcription","Item Type Metadata:Local URL","Item Type Metadata:Original Format","Item Type Metadata:Physical Dimensions","Item Type Metadata:From","Item Type Metadata:To","Item Type Metadata:Number of Attachments","Item Type Metadata:URL","Item Type Metadata:Birth Date","Item Type Metadata:Birthplace","Item Type Metadata:Death Date","Item Type Metadata:Biographical Text","Item Type Metadata:Bibliography","Item Type Metadata:Journal Entry","Item Type Metadata:Footnotes","Item Type Metadata:Location",tags,file,itemType,collection,public,featured
2722,https://georgeeliotarchive.org/items/show/2722,"Evans, Robert (1773-1849)",,"Eliot's father Robert Evans was the fourth son of a carpenter. After basic schooling, he was apprenticed to his father's trade and then set up a carpentry business. A local landowner, Francis Parker noticed his ability and invited him in 1802 to manage an estate he had inherited in Derbyshire. In 1806, after the death of Sir Roger Newdigate, Francis Parker inherited the Arbury estate near Nuneaton in Warwickshire and once again asked Evans to manage it. This began a long career in estate management, where Evans earned the reputation of being fair, honest, and hard working.<br /><br />Evans married twice. His first wife was a servant of the Parker family, Harriet Poynton, who had two children and died giving birth to a third in 1809. Evans remarried to a farmer's daughter, Christiana, who gave birth to three children: Christiana 'Chrissey', Isaac, and Mary Ann (the future George Eliot). She also gave birth to twin boys in 1821 who did not survive childbirth. Eliot was apparently much closer to her father than to her mother, about whom she writes almost nothing.<br /><br />When Christiana died, Eliot took over much of the domestic work in the house and became indispensable to her father. Evans encouraged Eliot's intellectual development and paid for tutors in German and Italian. Eventually, Evans retired and his son Isaac took over the estate management in 1841. Evans and Eliot moved to Coventry, where a dispute soon arose after Eliot began interacting with the radical Brays. Evans, who benefited from the support of the upper class in his life, was a staunch conservative. Eventually, Eliot announced that she could no longer believe in Christianity and refused to accompany him to church, which infuriated her father. It took several weeks and an intervention from Isaac to mend the rift. Evans' health began to decline in 1845, and for the next four years as his health declined, Eliot devoted herself to caring for him. He passed away in 1849. The experience left a strong impression on Eliot, whose fiction frequently includes scenes of tending loved ones at the time of their deaths.",,"<a href=""https://www.npg.org.uk/collections/search/portrait/mw02149/Robert-Evans?LinkID=mp01506&amp;search=sas&amp;sText=robert+evans&amp;role=sit&amp;rNo=0"">https://www.npg.org.uk/collections/search/portrait/mw02149/Robert-Evans?LinkID=mp01506&amp;search=sas&amp;sText=robert+evans&amp;role=sit&amp;rNo=0</a>","<em>George Eliot Archive</em>, edited by Beverley Park Rilett, https://georgeeliotarchive.org",,,,"4:130, 4:140, 4:299, 4:306 
Mrs. Robert Evans: 4:133, 7:105, 8:316",,,,,,,,,,,,,,,,,,,,,,,"colleagues,family,Family & Friends of George Eliot,friends,George Eliot's colleagues,George Eliot's friends,George Eliot's relations,George Eliot's Social Network,relationship map,relationship web,Social Network",https://georgeeliotarchive.org/files/original/c2add7848155c27075b7953da8c19780.jpg,Portrait,"George Eliot's Social Network",1,0
2721,https://georgeeliotarchive.org/items/show/2721,"Evans, Isaac Pearson (1816-1890)",,"Older than his sister by three years, Isaac Evans was quite close to George Eliot when they were children but grew apart as he became more conservative and she more radical. Isaac and Eliot spent their childhood as constant companions until being sent to separate boarding schools. While aging and separation did cause some distance, the two remained on good terms while they both lived in the Warwickshire country of their upbringing. When Eliot was still living with her father in Coventry, Isaac and his wife, Sarah, offered their own house for her to stay in despite a previous falling out over Eliot's refusal to attend church. After their father retired, Isaac Evans took over the family business of estate management and also seemed to take on some of his social expectations.<br /><br />Eliot avoided telling her family of her relationship with George Henry Lewes for three years; when she did finally tell Isaac in 1857 that she had a 'husband,' her brother quickly found out the truth--that she was living with an already-married man. Consequently, he cut off all communication with her and demanded their sisters Fanny and Chrissey do the same. Evans did not speak to his sister for 23 years, though his wife did send condolences to Eliot when Lewes died. The silence was not broken until Evans heard of Eliot's marriage to John Cross, where he wrote to her with congratulations. The two exchanged letters, saying they were still fond of each other even after the long separation. Before they could be reunited in person, Eliot unexpectedly died. Evans seemed to feel true sorrow, to the extent that he made the difficult trek during winter to attend her funeral in London. Isaac Evans outlived his sister by ten years, but is forever memorialized in the character of Tom Tulliver in Eliot's <em>The Mill on the Floss</em>.",,,"<em>George Eliot Archive</em>, edited by Beverley Park Rilett, https://georgeeliotarchive.org",,,,"1:XLIX, 1:LXV, 1:LXVII, 1:3, 1:4, 1:6, 1:7, 1:13, 1:24, 1:25, 1:29, 1:42, 1:50, 1:57, 1:60, 1:68, 1:89, 1:93, 1:97, 1:98, 1:112, 1:129, 1:132, 1:133, 1:134, 1:156-6, 1:201, 1:258, 1:272, 1:298, 1:307, 1:330, 1:33 2:73, 2:75, 2:97, 2:134, 2:178, 2:184, 2:188, 2:197, 2:202, 2:317, 2:320, 2:331, 2:333, 2:336, 2:342, 2:346, 2:349, 2:364, 2:3983:26, 3:98, 3:99, 3:2246:45, 6:2787:105, 7:280, 7:285, 2:287",,,,,,,,,,,,,,,,,,,,,,,"colleagues,family,Family & Friends of George Eliot,friends,George Eliot's colleagues,George Eliot's friends,George Eliot's relations,George Eliot's Social Network,relationship map,relationship web,Social Network",https://georgeeliotarchive.org/files/original/5d9768864c494981e4dd6a7f9c7df8a1.png,Portrait,"George Eliot's Social Network",1,0
2720,https://georgeeliotarchive.org/items/show/2720,"Evans, Elizabeth Tomlinson (1766-1849)",,"Elizabeth Evans was the wife of George Eliot’s paternal uncle, Samuel Evans. She was one of the many female preachers of her time, and her astute Methodism influenced Eliot in writing <em>Adam Bede</em>.",,,"<em>George Eliot Archive</em>, edited by Beverley Park Rilett, https://georgeeliotarchive.org",,,,"1:14, 1:18, 1:73, 1:82",,,,,,,,,,,,,,,,,,,,,,,"colleagues,family,Family & Friends of George Eliot,friends,George Eliot's colleagues,George Eliot's friends,George Eliot's relations,George Eliot's Social Network,relationship map,relationship web,Social Network",https://georgeeliotarchive.org/files/original/9f01359a11b80385e9d89add51c96fa0.png,Portrait,"George Eliot's Social Network",1,0
2719,https://georgeeliotarchive.org/items/show/2719,"Evans, Christiana Pearson (1788-1836)",,"Christiana Evans was George Eliot's mother. The daughter of a farmer, Isaac Pearson, Christiana married Robert Evans in 1813. Christiana gave birth to three children: Christiana 'Chrissey' (1814); Isaac (1816); and Mary Ann (George Eliot) (1819); along with two twin boys (William and Thomas in 1821) who did not survive their birth. Christiana died in 1836.",,,"<em>George Eliot Archive</em>, edited by Beverley Park Rilett, https://GeorgeEliotArchive.org",,,,,,,,,,,,,,,,,,,,,,,,,,,"colleagues,family,Family & Friends of George Eliot,friends,George Eliot's colleagues,George Eliot's friends,George Eliot's relations,George Eliot's Social Network,relationship map,relationship web,Social Network",https://georgeeliotarchive.org/files/original/cfdd1f10696834c90531e5f4e9d94bce.png,Portrait,"George Eliot's Social Network",1,0
2718,https://georgeeliotarchive.org/items/show/2718,"Druce, Anna Bowling Buchanan (1841-1921)",,"Anna Bowling Buchanan Druce was the sister of John Cross and married Albert Druce.",,,"<em>George Eliot Archive</em>, edited by Beverley Park Rilett, https://georgeeliotarchive.org",,,,"6:105, 7:311, 7:316, 7:339 ; Written to her husband: 6:39, 7:266",,,,,,,,,,,,,,,,,,,,,,,"colleagues,family,Family & Friends of George Eliot,friends,George Eliot's colleagues,George Eliot's friends,George Eliot's relations,George Eliot's Social Network,relationship map,relationship web,Social Network",https://georgeeliotarchive.org/files/original/9cbcf61437a7887f5b68199c11a9a9de.png,Portrait,"George Eliot's Social Network",1,0
2717,https://georgeeliotarchive.org/items/show/2717,"Deutsch, Emanuel Oscar Menahem (1829-1873)",,"Emanuel Menahem Deutsch was a friend of George Eliot's and George Henry Lewes's. Some critics have speculated that he may have been a model for Mordecai in <i>Daniel Deronda</i>. Deutsch gave Hebrew lessons to Eliot and answered her questions regarding Judaism, Jewish history, and the significance of the land of Israel. Deutsch and Eliot shared a close relationship between 1867 and his death in 1872 according to Eliot's letters.",,,"<em>George Eliot Archive</em>, edited by Beverley Park Rilett, https://georgeeliotarchive.org",,,,"4:266, 4:336, 4:364, 4:365, 4:384, 4:399, 4:409, 4:440, 4:446, 4:4485:39, 5:45, 5:73, 5:100, 5:115, 5:154, 5:160, 5:344, 5:37",,,,,,,,,,,,,,,,,,,,,,,"colleagues,family,Family & Friends of George Eliot,friends,George Eliot's colleagues,George Eliot's friends,George Eliot's relations,George Eliot's Social Network,relationship map,relationship web,Social Network",https://georgeeliotarchive.org/files/original/e3daa471b28f00a9404f6d18f76e15e9.png,Portrait,"George Eliot's Social Network",1,0
2716,https://georgeeliotarchive.org/items/show/2716,"D'Albert-Durade, Julie Covelle (1800-1880)",,"Julie Covelle D'Albert-Durade was an artist who specialized in painting flowers, and was married to Francois D'Albert-Durade. She met George Eliot when Eliot boarded in the D'Albert-Durade residence in Geneva, Switzerland. The two fostered a very close relationship while Eliot lived in Geneva, with Eliot calling her 'Maman.' Eliot exchanged letters with the D'Alberts for many years after, although Francois admitted to destroying many of their letters to protect her privacy.",,,"<em>George Eliot Archive</em>, edited by Beverley Park Rilett, https://georgeeliotarchive.org",,,,3:313,,,,,,,,,,,,,,,,,,,,,,,"colleagues,family,Family & Friends of George Eliot,friends,George Eliot's colleagues,George Eliot's friends,George Eliot's relations,George Eliot's Social Network,relationship map,relationship web,Social Network",https://georgeeliotarchive.org/files/original/9f4c2b2babb2a964a73762d11ea1518c.png,Portrait,"George Eliot's Social Network",1,0
2715,https://georgeeliotarchive.org/items/show/2715,"Dickens, Charles (1812-1870)",,"Charles Dickens crossed paths with George Eliot in May of 1852 at John Chapman's residence in the Strand, where he chaired a meeting to protest the price-fixing of the Booksellers' Association. While Eliot found his appearance undistinguished, showing none of the benevolence she had expected, she was still impressed by having met him, describing him as a “man one can thoroughly enjoy talking to.” After having read the first of the two stories in <em>Scenes of Clerical Life</em>, Dickens wrote to Eliot through her publisher, praising the “exquisite truth and delicacy, both of the humour and the pathos” in them, and maintaining that the masculine name of the author did not convince him: “If they originated with no woman, I believe that no man ever before had the art of making himself, mentally, so like a woman, since the world began.” Eliot was deeply moved by this, but was unable to write back to him to express her appreciation due to “the iron mask of [her] incognito.” <br />After the publication of <em>Adam Bede</em>, Dickens wrote to her directly, announcing the pleasure in being able to address her as a woman and warmly praising the novel. Back in 1853, Lewes had attacked Dickens in his weekly paper, <em>The Leader</em>, over the lack of scientific realism in <em>Bleak House</em>, specifically, the spontaneous combustion of Mr. Krook. Dickens took offense and the friendship was strained for several years, but in November of 1859, Dickens put aside any remaining bitterness and accepted a visit to Eliot and Lewes’s home, where he met George Eliot in person for the first time. He hoped to convince her to write for his journal, <em>All the Year Round</em>, but she did not accept the invitation. The two remained on pleasant terms until Dickens’s untimely death in 1870.",,"<a href=""https://www-oxforddnb-com.libproxy.unl.edu/view/10.1093/ref:odnb/9780198614128.001.0001/odnb-9780198614128-e-1002826?rskey=eXcvu7&amp;result=3"">https://www-oxforddnb-com.libproxy.unl.edu/view/10.1093/ref:odnb/9780198614128.001.0001/odnb-9780198614128-e-1002826?rskey=eXcvu7&amp;result=3</a>","<em>George Eliot Archive</em>, edited by Beverley Park Rilett, https://georgeeliotarchive.org",,,,"1:LXVIII, 1:29, 1:164, 1:225, 1:337, 1:3652:11?, 2:17, 2:18, 2:23-25, 2:24, 2:52, 2:225?, 2:260, 2:280, 2:418, 2:423-4, 2:248, 2:429, 2:432, 2:46<br /><br /><span>3:6, 3:28, 3:31, 3:65, 3:114</span><span>-</span><span>5, 3:115, 3:146, </span><span>3:171, 3:192, 3:195, 3:197, 3:200, 3:203, </span><span>3</span><span>:203</span><span>-</span><span>5, 3:205, 3:210</span><span>-</span><span>1, 3:211, 3:225? 3:237, </span><span>3:245, 3:247, 3:261, 3:275, 3:315, 3:344, </span><span>3:351, 3:393, 3:434, 3:468</span><span>4:8, 4:18, 4:120, 4:266</span><span>-</span><span>7, 4:441</span><span>5:81</span><span>-</span><span>2, 5:82, 5:102, 5:184</span><span>-</span><span>6, 5:196, 5:226, </span><span>5:268, 5:307, 5:331, 5:464</span><span>6:15, 6:23, 6:28</span><span>-</span><span>9, 6:68, 6:171, 6:</span><span>201, 6:313</span><span>7:17, 7:385</span><span>?:172, ?:22</span>",,,,,,,,,,,,,,,,,,,,,,,"colleagues,family,Family & Friends of George Eliot,friends,George Eliot's colleagues,George Eliot's friends,George Eliot's relations,George Eliot's Social Network,relationship map,relationship web,Social Network",https://georgeeliotarchive.org/files/original/e73d1cc0e6449a18f6a0fe93d70f2c96.jpeg,Portrait,"George Eliot's Social Network",1,0
2714,https://georgeeliotarchive.org/items/show/2714,"Davies, Emily (1830-1921)",,"Emily Davies became friends with George Eliot through their mutual friend, Barbara Leigh Smith Bodichon, with whom Davies established Girton College, Cambridge. Eliot contributed fifty&nbsp; pounds to their cause—a relatively small donation. Davies campaigned for women's education and suffrage, and with Eliot's encouragement, wrote about these causes. Through letters to Davies, Eliot’s cautious support of the women’s movement can be observed.",,"<a href=""https://www-oxforddnb-com.libproxy.unl.edu/view/10.1093/ref:odnb/9780198614128.001.0001/odnb-9780198614128-e-1009348"">https://www-oxforddnb-com.libproxy.unl.edu/view/10.1093/ref:odnb/9780198614128.001.0001/odnb-9780198614128-e-1009348</a>","<em>George Eliot Archive</em>, edited by Beverley Park Rilett, https://georgeeliotarchive.org",,,,"4:199; 4:401, 4:425, 4:4675:586:2857:27, 7:2",,,,,,,,,,,,,,,,,,,,,,,"colleagues,family,Family & Friends of George Eliot,friends,George Eliot's colleagues,George Eliot's friends,George Eliot's relations,George Eliot's Social Network,relationship map,relationship web,Social Network",https://georgeeliotarchive.org/files/original/1f3412b4c6cc006cbd9c4fc7189e3768.png,Portrait,"George Eliot's Social Network",1,0
2712,https://georgeeliotarchive.org/items/show/2712,"Linton, Eliza Lynn (1822-1898)",,"A journalist and author, Eliza Lynn Linton was a longtime rival of George Eliot's. She both praised and spitefully criticized Eliot in her memoirs, which are more balanced assessments than most biographers acknowledge. The two traveled in the same social circles; Linton knew John Chapman and Dr. Robert Brabant and had a close friendship with Sara Hennell and the Brays. Linton and Eliot met while Eliot was living at Chapman’s boarding house, a meeting that both women recorded, but with very different impressions of the evening. Eliot wrote later that Linton was obviously fawning over her, while Linton wrote that she was not impressed with Eliot. Eliza Lynn married the widowed W. J. Linton in 1858 and took care of his seven children, though the two separated in 1866. Linton was jealous that Eliot could focus on her writing while Lewes took care of all her other affairs, unlike Linton who wrote under the pressure of financial need and constant caretaking duties. Linton is most famous for her ""Girl of the Period"" series of anti-feminist articles written for the conservative <em>Saturday Review</em>.",,"<a href=""https://commons.wikimedia.org/wiki/File:Eliza_Lynn_Linton.jpg"" target=""_blank"" rel=""noopener"">https://commons.wikimedia.org/wiki/File:Eliza_Lynn_Linton.jpg</a>","<em>George Eliot Archive</em><span>, edited by Beverley Park Rilett, https://GeorgeEliotArchive.org</span>",,,,"4:319, 4:326 ",,,,,,,,,,,,,,,,,,,,,,,"colleagues,family,Family & Friends of George Eliot,friends,George Eliot's colleagues,George Eliot's friends,George Eliot's relations,George Eliot's Social Network,relationship map,relationship web,Social Network",https://georgeeliotarchive.org/files/original/6df84f431bce1cc5ea21df9771610133.png,Portrait,"George Eliot's Social Network",1,0
2711,https://georgeeliotarchive.org/items/show/2711,"Bulwer-Lytton, Edward George (1803-1873)",,"Edward George Bulwer-Lytton (b. 25 May 1803, d. 18 January 1873) was an English writer and friend of George Henry Lewes. Lytton was a baron and served as a Whig in the English government. Lytton's literary legacy is present today in the lasting phrases, ""the pen is mightier than the sword"" and ""it was a dark and stormy night."" He had a tumultuous marriage to <span>Rosina Anne Doyle Wheeler but had two children together, their son Edward Robert Bulwer-Lytton and their daughter who died at the age of nineteen.</span>",,"<a href=""https://www-oxforddnb-com.libproxy.unl.edu/view/10.1093/ref:odnb/9780198614128.001.0001/odnb-9780198614128-e-1000759#odnb-9780198614128-e-1000759-mediaGroup-1"" target=""_blank"" rel=""noopener"">https://www-oxforddnb-com.libproxy.unl.edu/view/10.1093/ref:odnb/9780198614128.001.0001/odnb-9780198614128-e-1000759#odnb-9780198614128-e-1000759-mediaGroup-1</a>","<em>George Eliot Archive</em><span>, edited by Beverley Park Rilett, https://GeorgeEliotArchive.org</span>",,,,"8:261, 8:313, 8:378, 8:429 ",,,,,,,,,,,,,,,,,,,,,,,"colleagues,family,Family & Friends of George Eliot,friends,George Eliot's colleagues,George Eliot's friends,George Eliot's relations,George Eliot's Social Network,relationship map,relationship web,Social Network",https://georgeeliotarchive.org/files/original/3b448554f83930f2cca7440c04183e0c.png,Portrait,"George Eliot's Social Network",1,0
2710,https://georgeeliotarchive.org/items/show/2710,"Bulwer-Lytton, Robert  (1831-1891)",,"Robert Bulwer-Lytton was the son of Edward George Bulwer-Lytton and was a younger friend and mentee of George Henry Lewes. Lytton wrote popular poetry under the name Owen Meredith. He was suspected to have had romantic relationships with men, and Oscar Wilde dedicated <i>Lady Windermere's Fan </i>to him. Lytton was married to Edith Villiers and had seven children with her.",,"<a href=""https://en.wikipedia.org/wiki/Robert_Bulwer-Lytton,_1st_Earl_of_Lytton#/media/File:Robert_Bulwer-Lytton_by_Nadar.jpg"" target=""_blank"" rel=""noopener"">https://en.wikipedia.org/wiki/Robert_Bulwer-Lytton,_1st_Earl_of_Lytton#/media/File:Robert_Bulwer-Lytton_by_Nadar.jpg</a>","<em>George Eliot Archive</em><span>, edited by Beverley Park Rilett, https://GeorgeEliotArchive.org</span>",,,,,,,,,,,,,,,,,,,,,,,,,,,"colleagues,family,Family & Friends of George Eliot,friends,George Eliot's colleagues,George Eliot's friends,George Eliot's relations,George Eliot's Social Network,relationship map,relationship web,Social Network",https://georgeeliotarchive.org/files/original/5f8a967c0272420e56d8906ee24d6dce.png,Portrait,"George Eliot's Social Network",0,0
2709,https://georgeeliotarchive.org/items/show/2709,"Main, Alexander (1841-1918)",,"Alexander Main was a reader and disciple of George Eliot’s novels. He introduced himself to Eliot in a letter in 1871, praising her novels extravagantly. Eliot responded that his appreciation made her cry for joy. Main proposed to compile an anthology of <i>Wise, Witty, and Tender Sayings in Prose and Verse, Selected from the Work of George Eliot</i>, which was published by Blackwood in time for Christmas, 1871. In his preface, Main compares Eliot with Shakespeare and maintains that ""she had forever sanctified the novel by making it the vehicle of the grandest and most uncompromising moral truth.” Main also assembled a series of quotations for the <em>George Eliot Birthday Book</em>, a diary decorated with inspirational aphorism from the author for each day of the year. Eliot and George Henry Lewes worried the diary was vulgar and were critical of the book’s binding. Nevertheless, Lewes encouraged Main’s devotion.",,,"<em>George Eliot Archive</em><span>, edited by Beverley Park Rilett, https://GeorgeEliotArchive.org</span>",,,,"5:174, 5:175, 5:182, 5:184, 5:192, 5:194, 5:201, 5:205, 5:210, 5:211, 5:212, 5:213, 5:218, 5:228, 5:229, 5:239, 5:250, 5:260, 5:267, 5:275, 5:283, 5:292, 5:297, 5:300, 5:302, 5:309, 5:323, 5:325, 5:337, 5:358, 5:360, 5:366, 5:382, 5:396, 5:397, 5:398, 5:399, 5:404, 5:415, 5:417, 5:431, 5:439, 5:442, 5:447, 5:449, 5:460, 5:465, 5:470, 5:472, 6:6, 6:7, 6:12, 6:20, 6:30, 6:49, 6:71, 6:79, 6:95, 6:106, 6:125, 6:128, 6:131, 6:146, 6:156, 6:175, 6:209, 6:218, 6:226, 6:244, 6:362, 6:431, 6:433 ",,,,,,,,,,,,,,,,,,,,,,,"colleagues,family,Family & Friends of George Eliot,friends,George Eliot's colleagues,George Eliot's friends,George Eliot's relations,George Eliot's Social Network,relationship map,relationship web,Social Network",https://georgeeliotarchive.org/files/original/2e7c89e1ceff3c54a64f356093dab179.pdf,Portrait,"George Eliot's Social Network",1,0
2706,https://georgeeliotarchive.org/items/show/2706,"Martineau, Harriet (1802-1876)",,"Harriet Martineau and George Eliot met through the Brays' Unitarian connections in 1845 and maintained an intimate relationship through the early 1850s. Eliot described Martineau as “the only English woman who possesses thoroughly the art of writing.” Their relationship was an uneasy one despite their frequent contact-- Martineau was committed to showing the world as it could be while Eliot showed the world as it is. Following George Eliot’s “liaison” with George Henry Lewes (Martineau’s literary rival), Eliot and Martineau contacted each other very little post-1854 but maintained a continued interest in each other’s lives and work.",,"<a href=""https://www-oxforddnb-com.libproxy.unl.edu/view/10.1093/ref:odnb/9780198614128.001.0001/odnb-9780198614128-e-1000419?rskey=lJNdwA&amp;result=1"" target=""_blank"" rel=""noopener"">https://www-oxforddnb-com.libproxy.unl.edu/view/10.1093/ref:odnb/9780198614128.001.0001/odnb-9780198614128-e-1000419?rskey=lJNdwA&amp;result=1</a>","<em>George Eliot Archive</em><span>, edited by Beverley Park Rilett, https://GeorgeEliotArchive.org</span>",,,,,,,,,,,,,,,,,,,,,,,,,,,"colleagues,family,Family & Friends of George Eliot,friends,George Eliot's colleagues,George Eliot's friends,George Eliot's relations,George Eliot's Social Network,relationship map,relationship web,Social Network",https://georgeeliotarchive.org/files/original/a5a1dc39af6580b994adfb615a10c92f.png,Portrait,"George Eliot's Social Network",1,0
2669,https://georgeeliotarchive.org/items/show/2669,"Martineau, James (1805-1900)",,"The brother of Harriet Martineau, James Martineau was a theologian and a journalist. ",,"<a href=""https://www-oxforddnb-com.libproxy.unl.edu/view/10.1093/ref:odnb/9780198614128.001.0001/odnb-9780198614128-e-1000420"" target=""_blank"" rel=""noopener"">https://www-oxforddnb-com.libproxy.unl.edu/view/10.1093/ref:odnb/9780198614128.001.0001/odnb-9780198614128-e-1000420</a>","<em>George Eliot Archive</em><span>, edited by Beverley Park Rilett, https://GeorgeEliotArchive.org</span>",,,,"8:25 ",,,,,,,,,,,,,,,,,,,,,,,"colleagues,family,Family & Friends of George Eliot,friends,George Eliot's colleagues,George Eliot's friends,George Eliot's relations,George Eliot's Social Network,relationship map,relationship web,Social Network",https://georgeeliotarchive.org/files/original/c67cd6f66b748a45291fa1959637c3ce.png,Portrait,"George Eliot's Social Network",1,0
