"Item Id","Item URI","Dublin Core:Title","Dublin Core:Subject","Dublin Core:Description","Dublin Core:Creator","Dublin Core:Source","Dublin Core:Publisher","Dublin Core:Date","Dublin Core:Contributor","Dublin Core:Rights","Dublin Core:Relation","Dublin Core:Format","Dublin Core:Language","Dublin Core:Type","Dublin Core:Identifier","Dublin Core:Coverage","Item Type Metadata:Text","Item Type Metadata:Transcription","Item Type Metadata:Local URL","Item Type Metadata:Original Format","Item Type Metadata:Physical Dimensions","Item Type Metadata:From","Item Type Metadata:To","Item Type Metadata:Number of Attachments","Item Type Metadata:URL","Item Type Metadata:Birth Date","Item Type Metadata:Birthplace","Item Type Metadata:Death Date","Item Type Metadata:Biographical Text","Item Type Metadata:Bibliography","Item Type Metadata:Journal Entry","Item Type Metadata:Footnotes","Item Type Metadata:Location",tags,file,itemType,collection,public,featured
2772,https://georgeeliotarchive.org/items/show/2772,"Lewes, Charles Lee (1842-1891)",,"The oldest son of George Henry Lewes and his legal wife, Agnes Jervis Lewes, Charles Lee Lewes was the ""step-son"" with whom George Eliot had the closest relationship.&nbsp;<br /><br />Charles was named after his great-grandfather and was the oldest surviving child of George Henry Lewes; he outlived both his younger brothers, Thornton and Herbert. After attending school in Switzerland, Charles returned to England to live with his father and George Eliot in 1860. He remained living with them as he took the Civil Service Exams and, with the help of Anthony Trollope, received a job at the Post Office. <br /><br />In 1865, Charles married Gertrude Hill. He became both an important business partner and a source of emotional support to George Eliot after George Henry Lewes's death in 1878. He also supported Eliot's marriage to John Cross in 1880. In fact, Charles walked his step-mother down the aisle. <br /><br />Upon Eliot’s death, Charles was named the sole executor of her will. Charles was an industrious man in his life and his accomplishments ranged from writing translations, campaigning, and becoming one of the first members of the Greater London Council. Charles died in 1891 in Egypt after his doctor sent him away from the British climate.",,"<a href=""https://www.npg.org.uk/collections/search/portrait/mw130705/Charles-Lee-Lewes?LinkID=mp89113&amp;search=sas&amp;sText=charles+lewes&amp;role=sit&amp;rNo=1"" target=""_blank"" rel=""noopener"">https://www.npg.org.uk/collections/search/portrait/mw130705/Charles-Lee-Lewes?LinkID=mp89113&amp;search=sas&amp;sText=charles+lewes&amp;role=sit&amp;rNo=1</a>","<em>George Eliot Archive</em><span>, edited by Beverley Park Rilett, https://GeorgeEliotArchive.org</span>",,,,"3:125, 3:177, 3:215, 3:242, 3:273, 3:407, 3:408, 3:411, 3:413, 3:418, 3:421, 3:451, 4:20, 4:26, 4:29, 4:31, 4:36, 4:53, 4:54, 4:76, 4:90, 4:150, 4:151, 4:163, 4:185, 4:272, 4:281, 4:283, 4:331, 4:345, 4:383, 4:387, 4:420, 4:454, 4:478, 5:36, 5:72, 5:85, 5:91, 5:96, 5:110, 5:126, 5:135, 5:143, 5:149, 5:154, 5:161, 5:176, 5:180, 5:278, 5:316, 5:423, 5:424, 6:59, 6:77, 6:153, 6:184, 6:264, 6:267, 7:38, 7:64, 7:73, 7:84, 7:87, 7:88, 7:90, 7:106, 7:143, 7:156, 7:158, 7:161, 7:167, 7:175, 7:177, 7:178, 7:179, 7:184, 7:187, 7:190, 7:193, 7:201, 7:205, 7:213, 7:216, 7:217, 7:222, 7:224, 7:276, 7:282, 7:288, 7:293, 7:302, 7:304, 7:306, 7:311, , 7:318, 7:318, 7:325, 7:327, 7:329, 7:338, 8:120, 8:164, 8:174, 8:190, 8:282, 8:451 ",,,,,,,,,,,,,,,,,,,,,,,"colleagues,family,Family & Friends of George Eliot,friends,George Eliot's colleagues,George Eliot's friends,George Eliot's relations,George Eliot's Social Network,relationship map,relationship web,Social Network",https://georgeeliotarchive.org/files/original/56900fb6fab8e026b55cc7804ea4cd56.png,Portrait,"George Eliot's Social Network",1,0
2771,https://georgeeliotarchive.org/items/show/2771,"Lewes, Elizabeth Ashweek Willim (1787-1870)",,"Elizabeth Ashweek Willim Lewes was the mother of George Henry Lewes. George Henry Lewes's father, John Lee Lewes, left the mother of four of his children (born between 1803 and 1808) to live with Elizabeth Ashweek in 1811. Together, they had 3 sons: Edgar James, Edward Charles, and George Henry Lewes. John Lee Lewes left the family around 1819 when George Henry was about 2 years old; (he died in 1831). Ashweek remarried in 1823 to a retired East India Company, Captain John Gurens Willim.&nbsp;<span>The family, long plagued by money troubles and housing insecurity, finally was well supported by George Henry Lewes&nbsp;late in her life, thanks to George Eliot's success as an author.</span>",,,"<em>George Eliot Archive</em><span>, edited by Beverley Park Rilett, https://GeorgeEliotArchive.org</span>",,,,"4:272 ",,,,,,,,,,,,,,,,,,,,,,,"colleagues,family,Family & Friends of George Eliot,friends,George Eliot's colleagues,George Eliot's friends,George Eliot's relations,George Eliot's Social Network,relationship map,relationship web,Social Network",https://georgeeliotarchive.org/files/original/41de316e046beda7c9407f675b7dfce3.png,Portrait,"George Eliot's Social Network",1,0
2770,https://georgeeliotarchive.org/items/show/2770,"Lewes, George Henry (1817-1878)",,"A productive writer and critic, George Henry Lewes lived with George Eliot from 1854 until his death in 1878. Though little is known of his childhood, Lewes appears to have grown up plagued with financial problems and an unstable family unit. He found work as a clerk, and eventually attempted to break into the literary scene with a biography of Percy Bysshe Shelley. After meeting Shelley's friend Leigh Hunt, he hoped to forge a personal connection with Shelley's widow, Mary Wollstonecraft Shelley. Unfortunately for Lewes, Shelley's widow would not support the proposed biography. While the biography did not come to fruition, Leigh Hunt and his son Thornton Hunt remained a part of Lewes's life. <br /><br />Lewes's wife, Agnes, birthed three children to Lewes (Charles, Thornton, and Herbert), but by the late 1840s, their domestic relationship was withering. Because of his own beliefs in free sexual relations, probably borrowed from Shelley, Lewes allowed and perhaps even approved when Thornton Hunt began a sexual relationship with Agnes, which produced the first of four children in 1850. Lewes signed his name to the birth certificates for even Hunt's children, which made divorce options complicated if not impossible later on. <br /><br />While Lewes became successful in his writing endeavors, he fell into a great depression because of his domestic life. Even as he garnered praise for his works, including his popular <i>A Biographical History of Philosophy</i> and his many articles written for various magazines, Lewes did not recover from his depression until he met George Eliot through a common friend, Herbert Spencer. The two became lovers, perhaps as early as 1853, and by July 1854, when Lewes and Eliot traveled to Germany together and stayed on the continent for nearly 8 months, they had established themselves as a couple. Lewes went to Germany to conduct research for his <em>Life of Goethe</em>, while Eliot ostensibly joined him to provide German-to-English translation assistance. As it turned out, Lewes's <em>Life of Goethe</em>, which never mentions Eliot, not only enjoyed several reprintings during Lewes's lifetime but also was his most successful work. Lewes turned to more scientific articles after his Goethe biography, including a series of articles (later collected in book form) on marine life written while he and Eliot travelled to the English and Welsh coasts. Lewes sent his two elder sons to boarding school on the continent, possibly to save them from the gossip that plagued Lewes and Eliot in England. It took Lewes three years to reveal to his sons the fact of his relationship with Eliot. Thrilled to learn she was the celebrity author of <i>Adam Bede</i>, the boys accepted her and eventually would call her ""Mutter.""<br /><br />It was Lewes's support that encouraged Eliot to begin writing fiction. From the beginning, Lewes acted as an intermediary between Eliot and her publishers. While their relationship undoubtedly was vital in motivating George Eliot, some critics question Lewes's methods of isolating her from negative feedback. However, Lewes evidently found pleasure rather than jealousy in her success and wrote adoringly of her in letters to friends. <br /><br />In his later years, Lewes became editor to several important magazines, including the <i>Cornhill Magazine</i> in 1862 and the <i>Fortnightly Review</i> in 1865. Two of his children moved to Africa in this period to farm, though his son Thornton, ""Thornie,"" moved back in 1869 after contracting spinal meningitis. Lewes and Eliot nursed him until his death in that year. Herbert, ""Bertie,"" his youngest son died also, of tuberculosis, in Africa before he could return to England. At the end of his life, Lewes strove to complete his 5-volume magnum opus, <i>Problems of Life and Mind,</i> that combined physiology and psychology. The final two volumes would have remained unfinished had Eliot not picked up the pen after Lewes's death. Lewes was praised posthumously by many of his contemporaries for his long, successful life as a writer.",,,"<em>George Eliot Archive</em><span>, edited by Beverley Park Rilett, https://GeorgeEliotArchive.org</span>",,,,"2:139, 2:176, 2:269, 2:272, 2:273, 2:275, 2:276, 2:281, 2:294, 2:296, 2:296, 2:299, 2:307, 2:307, 2:308, 2:310, 2:312, 2:315, 2:316, 2:321, 2:321, 2:323, 2:325, 2:326, 2:328, 2:330, 2:334, 2:337, 2:338, 2:350, 2:361, 2:363, 2:365, 2:370, 2:370, 2:371, 2:372, 2:374, 2:378, 2:380, 2:386, 2:394, 2:405, 2:410, 2:416, 2:429, 2:430, 2:432, 2:435, 2:439, 2:446, 2:448, 2:448, 2:456, 2:461, 2:463, 2:466, 2:466, 2:468, 2:470, 2:473, 2:477, 2:479, 2:480, 2:481, 2:485, 2:487, 2:491, 2:491, 2:497, 2:498, 2:506, 2:513, 3:4, 3:4, 3:5, 3:8, 3:10, 3:12, 3:13, 3:28, 3:30, 3:31, 3:35, 3:36, 3:38, 3:46, 3:49, 3:50, 3:51, 3:54, 3:55, 3:57, 3:61, 3:63, 3:72, 3:73, 3:77, 3:87, 3:91, 3:105, 3:106, 3:115, 3:117, 3:127, 3:129, 3:135, 3:143, 3:145, 3:148, 3:152, 3:158, 3:165, 3:167, 3:183, 3:188, 3:189, 3:193, 3:195, 3:196, 3:203, 3:204, 3:208, 3:211, 3:212, 3:213, 3:242, 3:249, 3:250, 3:251, 3:252, 3:258, 3:261, 3:262, 3:266, 3:267, 3:268, 3:269, 3:269, 3:273, 3:273, 3:275, 3:279, 3:289, 3:290, 3:295, 3:306, 3:308, 3:318, 3:322, 3:325, 3:326, 3:327, 3:330, 3:331, 3:332, 3:335, 3:341, 3:345, 3:348, 3:349, 3:350, 3:352, 3:357, 3:363, 3:375, 3:378, 3:380, 3:385, 3:387, 3:406, 3:407, 3:410, 3:411, 3:413, 3:418, 3:420, 3:421, 3:422, 3:429, 3:430, 3:434, 3:435, 3:441, 3:443, 3:444, 3:445, 3:457, 3:459, 3:461, 3:463, 3:465, 3:470, 3:473, 4:17, 4:19, 4:22, 4:24, 4:27, 4:29, 4:31, 4:33, 4:36, 4:47, 4:50, 4:52, 4:53, 4:54, 4:58, 4:76, 4:80, 4:82, 4:102, 4:111, 4:112, 4:115, 4:122, 4:126, 4:132, 4:137, 4:143, 4:150, 4:151, 4:163, 4:165, 4:172, 4:184, 4:185, 4:192, 4:194, 4:240, 4:241, 4:242, 4:243, 4:252, 4:253, 4:254, 4:255, 4:258, 4:263, 4:265, 4:270, 4:272, 4:281, 4:283, 4:283, 4:289, 4:325, 4:327, 4:330, 4:331, 4:334, 4:345, 4:360, 4:383, 4:392, 4:399, 4:400, 4:405, 4:415, 4:416, 4:417, 4:434, 4:441, 4:441, 4:449, 4:449, 4:450, 4:450, 4:451, 4:452, 4:454, 4:456, 4:458, 4:469, 4:489, 4:495, 5:4, 5:4, 5:7, 5:10, 5:11, 5:17, 5:18, 5:19, 5:20, 5:20, 5:29, 5:33, 5:36, 5:46, 5:66, 5:69, 5:79, 5:50, 5:83, 5:85, 5:87, 5:94, 5:96, 5:126, 5:139, 5:143, 5:145, 5:148, 5:151, 5:163, 5:164, 5:165, 5:176, 5:179, 5:180, 5:182, 5:185, 5:189, 5:190, :190, 5:191, 5:192, 5:193, 5:194, 5:195, 5:195, 5:196, 5:198, 5:198, 5:200, 5:201, 5:201, 5:202, 5:202, 5:204, 5:205, 5:210, 5:211, 5:213, 5:214, 5:216, 5:218, 5:219, 5:223, 5:224, 5:225, 5:228, 5:234, 5:243, 5:244, 5:245, 5:246, 5:248, 5:250, 5:254, 5:258, 5:260, 5:262, 5:263, 5:264, 5:266, 5:267, 5:268, 5:275, 5:277, 5:278, 5:282, 5:283, 5:286, 5:290, 5:292, 5:297, 5:298, 5:299, 5:299, 5:300, 5:302, 5:303, 5:305, 5:308, 5:308, 5:309, 5:310, 5:311, 5:313, 5:316, 5:319, 5:326, 5:330, 5:332, 5:337, 5:339, 5:347, 5:349, 5:352, 5:353, 5:357, 5:360, 5:363, 5:364, 5:365, 5:368, 5:369, 5:370, 5:371, 5:376, 5:377,  5:386, 5:396, 5:397, 5:398, 5:399, 5:400, 5:402, 5:409, 5:410, 5:410, 5:413, 5:414, 5:415, 5:416, 5:416, 5:420, 5:420, 5:423, 5:424, 5:431, 5:433, 5:442, 5:447, 5:449, 5:453, 5:462, 5:465, 5:469, 5:470, 5:472, 6:6, 6:9, 6:11, 6:12, 6:20, 6:30, 6:39, 6:39, 6:41, 6:42, 6:44, 6:59, 6:61, 6:71, 6:77, 6:78, 6:79, 6:85, 6:86, 6:95, 6:102, 6:114, 6:118, 6:120, 6:121, 6:125, 6:128, 6:129, 6:131, 6:138, 6:138, 6:153, 6:154, 6:156, 6:159, 6:160, 6:168, 6:169, 6:171, 6:175, 6:180, 6:180, 6:188, 6:192, 6:196, 6:197, 6:201, 6:202, 6:203, 6:204, 6:205, 6:205, 6:209, 6:210, 6:211, 6:212, 6:212, 6:213, 6:214, 6:215, 6:217, 6:218, 6:218, 6:219, 6:224, 6:225, 6:226, 6:227, 6:228, 6:233, 6:236, 6:237, 6:238, 6:243, 6:247, 6:248, 6:249, 6:252, 6:254, 6:255, 6:256, 6:256, 6:257, 6:259, 6:260, 6:261, 6:262, 6:262, 6:262, 6:254, 6:267, 6:274, 6:278, 6:281, 6:284, 6:292, 6:293, 6:298, 6:299, 6:300, 6:303, 6:306, 6:307, 6:309, 6:310, 6:312, 6:312, 6:313, 6:322, 6:323, 6:328, 6:331, 6:332, 6:334, 6:336, 6:344, 6:345, 6:348, 6:349, 6:354, 6:356, 6:358, 6:360, 6:360, 6:362, 6:363, 6:365, 6:367, 6:372, 6:373, 6:375, 6:380, 6:386, 6:388, 6:389, 6:391, 6:393, 6:395, 6:400, 6:410, 6:412, 6:412, 6:429, 6:434, 6:436, 6:437, 7:7, 7:9, 7:10, 7:12, 7:14, 7:16, 7:20, 7:25, 7:26, 7:28, 7:30, 7:35, 7:38, 7:38, 7:41, 7:43, 7:44, 7:47, 7:49, 7:50, 7:52, 7:57, 7:60, 7:64, 7:65, 7:73, 7:76, 7:78, 7:79, 8:76, 8:77, 8:77, 8:112, 8:117, 8:117, 8:120, 8:139, 8:140, 8:141, 8:141, 8:142, 8:143, 8:143, 8:144, 8:145, 8:147, 8:148, 8:149, 8:149, 8:150, 8:152, 8:153, 8:154, 8:155, 8:156, 8:156, 8:157, 8:158, 8:159, 8:160, 8:161, 8:161, 8:162, 8:162, 8:164, 8:166, 8:168, 8:168, 8:170, 8:172, 8:173, 8:176, 8:178, 8:179, 8:179, 8:180, 8:181, 8:182, 8:183, 8:183, 8:185, 8:185, 8:186, 8:188, 8:189, 8:189, 8:192, 8:193, 8:194, 8:195, 8:195, 8:196, 8:197, 8:198, 8:198, 8:199, 8:200, 8:202, 8:203, 8:204, 8:205, 8:206, 8:207, 8:209, 8:210, 8:211, 8:212, 8:213, 8:214, 8:215, 8:215, 8:216, 8:216, 8:221, 8:222, 8:223, 8:223, 8:225, 8:226, 8:227, 8:228, 8:229, 8:230, 8:232, 8:233, 8:234, 8:235, 8:235, 8:235, 8:236, 8:236, 8:237, 8:237, 8:238, 8:239, 8:240, 8:243, 8:245, 8:249, 8:251, 8:252, 8:253, 8:254, 8:254, 8:258, 8:258, 8:259, 8:259, 8:260, 8:264, 8:266, 8:268, 8:269, 8:270, 8:272, 8:272, 8:273, 8:273, 8:274, 8:274, 8:275, 8:277, 8:279, 8:281, 8:282, 8:286, 8:288, 8:294, 8:300, 8:301, 8:302, 8:303, 8:304, 8:305, 8:308, 8:308, 8:309, 8:311, 8:312, 8:313, 8:315, 8:315, 8:316, 8:319, 8:321, 8:323, 8:323, 8:327, 8:328, 8:330, 8:332, 8:334, 8:335, 8:336, 8:337, 8:338, 8:338, 8:339, 8:340, 8:342, 8:343, 8:346, 8:347, 8:347, 8:348, 8:349, 8:350, 8:351, 8:352, 8:354, 8:356, 8:356, 8:357, 8:357, 8:360, 8:360, 8:361, 8:362, 8:364, 8:365, 8:366, 8:370, 8:373, 8:373, 8:374, 8:375, 8:375, 8:377, 8:379, 8:382, 8:384, 8:386, 8:386, 8:387, 8:388, 8:389, 8:389, 8:390, 8:394, 8:395, 8:397, 8:398, 8:398, 8:399, 8:399, 8:400, 8:401, 8:403, 8:404, 8:406, 8:407, 8:408, 8:411, 8:412, 8:412, 8:413, 8:416, 8:418, 8:419, 8:420, 8:425, 8:4268:429, 8:430, 8:431, 8:436, 8:436, 8:437, 8:438, 8:439, 8:439, 8:441, 8:445, 8:446, 8:446, 8:447, 8:447, 8:448, 8:450, 8:451, 8:452, 8:453, 8:455, 8:456, 8:464, 8:470, 8:472, 8:474, 8:474, 8:476, 8:477, 8:478, 8:479, 8:481, 8:481, 8:483, 8:485, 8:486, 8:486, 8:490 ",,,,,,,,,,,,,,,,,,,,,,,"colleagues,family,Family & Friends of George Eliot,friends,George Eliot's colleagues,George Eliot's friends,George Eliot's relations,George Eliot's Social Network,relationship map,relationship web,Social Network",https://georgeeliotarchive.org/files/original/55b5a9a00f8ff92149385206473af804.jpg,Portrait,"George Eliot's Social Network",1,0
2769,https://georgeeliotarchive.org/items/show/2769,"Lewes, Gertrude Hill (1837-1918)",,"Gertrude Hill married George Henry Lewes's eldest son, Charles Lee, in 1865. She was the granddaughter of George Henry Lewes's longtime friend, Dr. Southwood Smith.",,,"<em>George Eliot Archive</em><span>, edited by Beverley Park Rilett, https://GeorgeEliotArchive.org</span>",,,,"4:185, 4:213, 4:234, 4:272, 4:283, 4:369, 4:383, 4:454, 5:36, 5:108, 5:126, 7:302, 8:451 ",,,,,,,,,,,,,,,,,,,,,,,"colleagues,family,Family & Friends of George Eliot,friends,George Eliot's colleagues,George Eliot's friends,George Eliot's relations,George Eliot's Social Network,relationship map,relationship web,Social Network",https://georgeeliotarchive.org/files/original/ecf98f687cd6e31e4d10303fc378f642.png,Portrait,"George Eliot's Social Network",1,0
2768,https://georgeeliotarchive.org/items/show/2768,"Lewes, Herbert ""Bertie"" Arthur (1846-1875)",,"The youngest son of George Henry Lewes, Herbert ""Bertie"" Lewes attended school in Switzerland in 1857, a year after his brothers set out to the same school. He returned to practice farming in Scotland before following his brother Thornton, ""Thornie,"" to Natal, Africa, to farm. In 1869, Thornie returned to England with fatal spinal meningitis, but Bertie continued to eke out a living in Natal. In 1871, Bertie married&nbsp;<span>Eliza Harrison, </span>the daughter of another Englishman, and the couple had two children, George and Marian. Shortly after the birth of George, in 1875, Bertie died of tuberculosis, which he contracted while living in Africa.",,,"<em>George Eliot Archive</em><span>, edited by Beverley Park Rilett, https://GeorgeEliotArchive.org</span>",,,,"8:252, 8:491 ",,,,,,,,,,,,,,,,,,,,,,,"colleagues,family,Family & Friends of George Eliot,friends,George Eliot's colleagues,George Eliot's friends,George Eliot's relations,George Eliot's Social Network,relationship map,relationship web,Social Network",https://georgeeliotarchive.org/files/original/4988e8e3c0d4dc208cab769c464c75a2.png,Portrait,"George Eliot's Social Network",1,0
2767,https://georgeeliotarchive.org/items/show/2767,"Lewes, Thornton ""Thornie"" Arnott (1844-1869)",,"<p>Thornton ""Thornie"" Lewes was the second son&nbsp;<span>of George Henry Lewes and Agnes Jarvis Lewes.&nbsp;</span>Thornie was named after Lewes's close friend (and Agnes's longtime lover), Thornton Hunt. He attended a day school in Bayswater until 1856, when, at the age of 12, he was sent with his older brother Charles to an international boarding school near Berne, Switzerland. His father was trying to shield his sons from the scandal caused by Agnes's and his own irregular living arrangements.<br /><span></span></p>
<p><span>Lewes finally introduced his sons to George Eliot in 1860, after she had achieved critical and popular success with <em>Adam Bede.&nbsp;</em></span>The boys knew of their mother's atypical living arrangements, and found a maternal figure in George Eliot. <span>Thornie affectionately called her&nbsp;</span><span>&nbsp;""Mutter"" until he died.&nbsp;</span></p>
<p>In 1863, Thornie failed his Civil Service exam at Edinburgh. Rather than re-sit the exam, he instead went to Natal, Africa, to try farming. His brother Herbert ""Bertie"" joined him not long after. The two eked out a living learning to farm, hunt, and barter &nbsp;with the locals until 1869, when Thornie wrote to his father that he was seriously ill. Thornie returned to England, where he was nursed by his father and George Eliot through a painful summer. In the fall, at age 25, Thornie died of spinal meningitis.</p>",,,"<em>George Eliot Archive</em><span>, edited by Beverley Park Rilett, https://georgeeliotarchive.org</span>",,,,"8:120, 8:166, 8:170, 8:178, 8:242, 8:259, 8:266, 8:270, 8:280, 8:284, 8:294, 8:321, 8:323, 8:343, 8:351, 8:366, 8:375, 8:390, 8:431 ",,,,,,,,,,,,,,,,,,,,,,,"colleagues,family,Family & Friends of George Eliot,friends,George Eliot's colleagues,George Eliot's friends,George Eliot's relations,George Eliot's Social Network,relationship map,relationship web,Social Network",https://georgeeliotarchive.org/files/original/d24aeeb956911bf5039e379576d6c687.png,Portrait,"George Eliot's Social Network",1,0
2766,https://georgeeliotarchive.org/items/show/2766,"Lewis, Maria (1800-1887)",,"<p>George Eliot's former teacher, Maria Lewis, was a crucial role model for Eliot growing up. When Eliot was sent to Lewis's school in Nuneaton, she was drawn to Lewis for approval, affection, and guidance. These feelings were intensified after Eliot's mother's death in 1836.</p>
<p>The two corresponded faithfully after Eliot left the school and Maria was usually spent her holidays with Eliot and her father in their Coventry home. <span>Lewis's Evangelical Christian beliefs had for many years influenced Eliot's; by 1841, however, Eliot had begun to question and doubt. In January 1842, Eliot&nbsp;</span>refused to attend church with Maria and her father, which started &nbsp;what Eliot later called a ""holy war."" This act caused a rift with Maria, which was not resolved until 1874, when Eliot learned Lewis's address and began sending her a yearly gift of money. Lewis's pride in her student was evident in her letters, where she claimed to know Eliot more intimately than any other.</p>",,,"<em>George Eliot Archive</em><span>, edited by Beverley Park Rilett, https://georgeeliotarchive.org</span>",,,,,,,,,,,,,,,,,,,,,,,,,,,"colleagues,family,Family & Friends of George Eliot,friends,George Eliot's colleagues,George Eliot's friends,George Eliot's relations,George Eliot's Social Network,relationship map,relationship web,Social Network",https://georgeeliotarchive.org/files/original/6503f1a42b3726eb6f2076c0c3f7f0a2.png,Portrait,"George Eliot's Social Network",1,0
2765,https://georgeeliotarchive.org/items/show/2765,"Liggins, Joseph (1800-1872)",,"Joseph Liggins was believed by some to be the true identity behind the pen name ""George Eliot"" when <em>Scenes of Clerical Life</em> was published in 1857. Residents of Nuneaton and the surrounding areas recognized the characters and stories as pieces of local history. Liggins, a poor journalist, was the only local writer they thought they knew. Liggins allowed his friends to think he'd authored <em>Scenes of Clericsl Life</em> and <em>Adam Bede</em> and that he was being cheated out of the royalties owed him by the books' publisher, Blackwood and Sons. The scandal over Liggins's supposed authorship was part of the reason Eliot finally revealed her identity to her friends after maintaining her anonymity for three years.&nbsp;",,"<a href=""https://www-oxforddnb-com.spot.lib.auburn.edu/view/10.1093/ref:odnb/9780198614128.001.0001/odnb-9780198614128-e-56706?rskey=TbyAli&amp;result=1"">https://www-oxforddnb-com.spot.lib.auburn.edu/view/10.1093/ref:odnb/9780198614128.001.0001/odnb-9780198614128-e-56706?rskey=TbyAli&amp;result=1&nbsp;</a>","<em>George Eliot Archive</em><span>, edited by Beverley Park Rilett, https://georgeeliotarchive.org</span>",,,,,,,,,,,,,,,,,,,,,,,,,,,"colleagues,family,Family & Friends of George Eliot,friends,George Eliot's colleagues,George Eliot's friends,George Eliot's relations,George Eliot's Social Network,relationship map,relationship web,Social Network",https://georgeeliotarchive.org/files/original/456abdaf62318b597815421d609a6497.png,Portrait,"George Eliot's Social Network",1,0
2755,https://georgeeliotarchive.org/items/show/2755,"Hill, Octavia (1838-1912)",,"Octavia Hill was a philanthropist George Eliot supported. Hill was a sister-in-law of Charles Lee Lewes and worked with underprivileged children in London when she met John Ruskin in 1853. Ruskin helped further Hill's philanthropic efforts. Eliot and Hill moved among similar social circles and Eliot gave money to Hill's public housing reform movements.",,"<a href=""https://www-oxforddnb-com.libproxy.unl.edu/view/10.1093/ref:odnb/9780198614128.001.0001/odnb-9780198614128-e-1000035?rskey=qf2WqC&amp;result=1"">https://www-oxforddnb-com.libproxy.unl.edu/view/10.1093/ref:odnb/9780198614128.001.0001/odnb-9780198614128-e-1000035?rskey=qf2WqC&amp;result=1</a>","<em>George Eliot Archive</em>, edited by Beverley Park Rilett, https://georgeeliotarchive.org",,,,"1:LXXI 4:184, 4:2135:124, 5:161, 5:284, 5:336, 5:371, 5:3736:31, 6:85, 6:1537:6, 7:38",,,,,,,,,,,,,,,,,,,,,,,"colleagues,family,Family & Friends of George Eliot,friends,George Eliot's colleagues,George Eliot's friends,George Eliot's relations,George Eliot's Social Network,relationship map,relationship web,Social Network",https://georgeeliotarchive.org/files/original/2687ee6123e6d3722e818604bd278164.png,Portrait,"George Eliot's Social Network",1,0
