"Item Id","Item URI","Dublin Core:Title","Dublin Core:Subject","Dublin Core:Description","Dublin Core:Creator","Dublin Core:Source","Dublin Core:Publisher","Dublin Core:Date","Dublin Core:Contributor","Dublin Core:Rights","Dublin Core:Relation","Dublin Core:Format","Dublin Core:Language","Dublin Core:Type","Dublin Core:Identifier","Dublin Core:Coverage","Item Type Metadata:Text","Item Type Metadata:Transcription","Item Type Metadata:Local URL","Item Type Metadata:Original Format","Item Type Metadata:Physical Dimensions","Item Type Metadata:From","Item Type Metadata:To","Item Type Metadata:Number of Attachments","Item Type Metadata:URL","Item Type Metadata:Birth Date","Item Type Metadata:Birthplace","Item Type Metadata:Death Date","Item Type Metadata:Biographical Text","Item Type Metadata:Bibliography","Item Type Metadata:Journal Entry","Item Type Metadata:Footnotes","Item Type Metadata:Location",tags,file,itemType,collection,public,featured
2651,https://georgeeliotarchive.org/items/show/2651,"Congreve, Richard (1818-1899)",,"Richard Congreve and George Eliot maintained a close friendship from 1859 to until Eliot's death. She was especially close to Maria Congreve, his wife.",,,"<em>George Eliot Archive</em>, edited by Beverley Park Rilett, https://GeorgeEliotArchive.org",,,,"1:lxi, 1:lxii; 1:lxvii, 1:lxviii, 1:242, 1:3532:456, 2:5003:16, 3:26, 3:32, 3:53; 3:62, 3:68, 3:70, 3:101, 3:115, 3:136, 3:177, 3:178, 3:179, 3:180, 3:182, 3:195, 3:197, 3:201, 3:206, 3:214, 3:227, 3:238, 3:287, 3:288, 3:293, 3:294, 3:298, 3:324, 3:330, 3:333, 3:349, 3:353, 3:367, 3:441, 3:460, 3:467, 3:476, 3:482, 3:4964:16, 4:52, 4:67, 4:71, 4:78, 4:83, 4:105, 4:107, 4:174, 4:200, 4:207, 4:227, 4:277, 4:378, 4:413, 4:430, 4:360, 4:363, 4:4985:26, 5:37, 5:75, 5:163, 5:238, 5:263, 5:342, 5:401, 5:4266:3027:64, 7:192, 7:234, 7:260, 7:296, 7:344-5",,,,,,,,,,,,,,,,,,,,,,,"colleagues,family,Family & Friends of George Eliot,friends,George Eliot's colleagues,George Eliot's friends,George Eliot's relations,George Eliot's Social Network,relationship map,relationship web,Social Network",https://georgeeliotarchive.org/files/original/d44cf4cfb548842f59e7937552c4b6ba.jpeg,Portrait,"George Eliot's Social Network",1,0
2650,https://georgeeliotarchive.org/items/show/2650,"Congreve, Maria Bury (1846-1915)",,"Maria Bury Congreve's father, Dr. Bury, was George Eliot's family physician and was the reason they met in their youth. They met again years later as neighbors in Wandsworth in 1859, when their husbands became acquainted. They remained good friends for several decades, up until Eliot's death. Maria and her husband, Richard Congreve, were attempting to establish a Positivist church in London. <br />The couple became two of the few people Eliot told about her fiction writing career before others uncovered the secret. Richard, who was a doctor, became an invaluable source of information while Eliot was writing Lydgate's story in <i>Middlemarch</i>. However, because of their Positivist prejudices against remarriage, Eliot did not confide to the couple of her impending marriage to Cross. In response to a short letter from Maria on the eve of the wedding, Eliot responded with a promise that Charles Lewes would explain 'a great, momentous change' that was coming: her marriage to John Cross. Eliot remained close to the couple for years after. (Letters 7:277)",,,"<em>George Eliot Archive</em>, edited by Beverley Park Rilett, https://GeorgeEliotArchive.org",,,,"1: lxi-lxiii3:26 3:32, 3:53, 3:62, 3:68-70, 3:79, 3:101, 3:112, 3:115-6, 3:120, 3:180, 3:197, 3:227, 3:238; 3:286-8, 3:292-3, 3:295, 3:303-4, 3:324, 3:330, 3:337, 3:349, 3:353, 3:363, 3:376, 3:440-1, 3:439, 3:460, 3:4674:5, 4:16, 4:60, 4:83, 4:111, 4:115, 4:127, 4:137, 4:160, 4:166, 4:171, 4:173, 4:176, 4:178, 4:179, 4:182, 4:191, 4:195, 4:199, 4:200, 4:206, 4:207, 4:209, 4:227, 4:269, 4:278, 4:293, 4:298, 4:324, 4:332, 4:344, 4:349, 4:378, 4:410, 4:415, 4:423, 4:429, 4:430, 4:474, 4:476, 4:482, 4:4875:25, 5:40, 5:50, 5:75, 5:86, 5:97, 5:124, 5:145, 5:163, 5:177, 5:238, 5:250, 5:264, 5:288, 5:291, 5:305, 5:342, 5:401, 5:412, 5:425, 5:4546:19, 6:8",,,,,,,,,,,,,,,,,,,,,,,"colleagues,family,Family & Friends of George Eliot,friends,George Eliot's colleagues,George Eliot's friends,George Eliot's relations,George Eliot's Social Network,relationship map,relationship web,Social Network",https://georgeeliotarchive.org/files/original/16e63279bebe20e9074756da4ad48503.png,Portrait,"George Eliot's Social Network",1,0
2649,https://georgeeliotarchive.org/items/show/2649,"Combe, George (1788-1858)",,"A phrenologist with interests in penal reform and education, George Combe met George Eliot in Charles Bray's home in 1851, during which he examined her head, proclaiming her to be extraordinary. He noted that she had looked 40 when in fact she was 32 and remarked on her delicate health, but felt that she had 'great analytic power and an instinctive soundness of judgment,' and that she appeared to be the ablest woman he had ever seen. His assessment revealed that she had a very large brain, noting the anterior lobe's large dimensions. Upon learning of Eliot's relationship with a married George Henry Lewes, Combe was horrified that his readings of her skull could have been so wrong. In strained letters to Bray, Combe suspected insanity in Eliot's family, which could only explain such a behavior.",,"<a href=""https://www-oxforddnb-com.libproxy.unl.edu/view/10.1093/ref:odnb/9780198614128.001.0001/odnb-9780198614128-e-1000229?rskey=cZYmfJ&amp;result=3"">https://www-oxforddnb-com.libproxy.unl.edu/view/10.1093/ref:odnb/9780198614128.001.0001/odnb-9780198614128-e-1000229?rskey=cZYmfJ&amp;result=3</a>","<em>George Eliot Archive</em>, edited by Beverley Park Rilett, https://GeorgeEliotArchive.org",,,,"1:193, 1:232, 1:352, 1:359, 1:361, 1:365, 1:369,1:372, 1:3742:12; 2:17, 2:22; 2:23, 2:31, 2:33, 2:37, 2:39, 2:43, 2:48, 2:49, 2:54, 2:56, 2:58, 2:59-62; 2:72, (80, 82, 83?), 2:98; 2:102; 2:104-6, 2:108; 2:113, 2:116, 2:117; 2:135, 2:137, 2:155;2:162, 2:183, 2:210, 2:214; 2:219, 2:222, 2:257, 2:264; 2:4793:1695:322 ",,,,,,,,,,,,,,,,,,,,,,,"colleagues,family,Family & Friends of George Eliot,friends,George Eliot's colleagues,George Eliot's friends,George Eliot's relations,George Eliot's Social Network,relationship map,relationship web,Social Network",https://georgeeliotarchive.org/files/original/7e0fc64c2c112a5c528af999e6e9da71.png,Portrait,"George Eliot's Social Network",1,0
2648,https://georgeeliotarchive.org/items/show/2648,"Clarke, Emily Susanna (1844-1924)",,"Emily Susanna Clarke was George Eliot's niece and Chrissey Evans' daughter. Eliot left Clarke a sum of 5,000 pounds in her will. ",,,"<em>George Eliot Archive</em>, edited by Beverley Park Rilett, https://GeorgeEliotArchive.org",,,,"6:150, 6:277 
8:250",,,,,,,,,,,,,,,,,,,,,,,"colleagues,family,Family & Friends of George Eliot,friends,George Eliot's colleagues,George Eliot's friends,George Eliot's relations,George Eliot's Social Network,relationship map,relationship web,Social Network",https://georgeeliotarchive.org/files/original/fabd8cdb9cee3b9d741aa73d1b1077a7.jpeg,Portrait,"George Eliot's Social Network",1,0
2647,https://georgeeliotarchive.org/items/show/2647,"Clarke, Edward (1809-1852)",,"Edward Clarke married George Eliot's sister, Chrissey, in 1837. The couple had nine children, but only five of them survived to adulthood. Clarke ran a medical practice in Meriden, near Coventry, but struggled to find customers in the small town. The family was very poor. Edward's death in 1852 left his wife and children in a precarious financial situation.",,,"<em>George Eliot Archive</em>, edited by Beverley Park Rilett, https://GeorgeEliotArchive.org",,,,"1:LXV, 1:4;1:95, 1:100, 1:141; 1:200; 1:258, 1:271, 1:301; 1:304, 1:336; 1:3562:73, 2:754:472",,,,,,,,,,,,,,,,,,,,,,,"colleagues,family,Family & Friends of George Eliot,friends,George Eliot's colleagues,George Eliot's friends,George Eliot's relations,George Eliot's Social Network,relationship map,relationship web,Social Network",https://georgeeliotarchive.org/files/original/5fe3353065bf71a87c4f69b257b12779.png,Portrait,"George Eliot's Social Network",1,0
2646,https://georgeeliotarchive.org/items/show/2646,"Clarke, Christiana Evans (1814-1859)",,"Chrissey ""Chrissey"" Evans was George Eliot's beloved older sister, the eldest child of Robert Evans and Christiana Pearson Evans. After their mother died in 1836, Chrissey took over the running of the house. The following year, in May of 1837, Chrissey married Edward Clarke, a poor doctor. The couple was plagued with economic problems after their marriage. Over the next 15 years, she would give birth to nine children, and five died in childhood. Eliot's character Gritty Tulliver Moss in <em>The Mill on the Floss</em> may be loosely based on her sister, Chrissey.<br /><br />Chrissey's husband, Edward Clarke ran a medical practice in a small town and struggled to make a living. When he died in 1852, he left Chrissey in a difficult financial position that drove her to seek help from her family. Eliot sent money to Chrissey many times, and cared deeply for her and her children. When Eliot revealed her relationship with George Henry Lewes, Chrissey and her half-sister Fanny followed strict orders from their brother Issac and stopped writing to their sister. Chrissey would not see her sister in person again, but, when she began to deteriorate form tuberculosis, the two reunited via letters, though not in person. Chrissey died from her illness in 1859.",,,"<em>George Eliot Archive</em>, edited by Beverley Park Rilett, https://GeorgeEliotArchive.org",,,,"1:LXV-LXXVII, 1:3-4; 1:7, 1:13, 1:43, 1:46-7, 1:51, 1:60, 1:67, 1:71; 1:79; 1:94-6, 1:100, 1:117; 1:127, 1:129; 1:140-2, 1:249; 1:298, 1:301; 1:304, 1:307, 1:314, 1:327-8, 1:330, 1:333, 1:336-72:73-5, 2:81, 2:84; 2:88, 2:90; 2:92, 2:96-8, 2:117, 2:124, 2:134-5, 2:150; 2:157, 2:182; 2:184, 2:204, 2:223-4, 2:262, 2:314; 2:317-8; 2:320, 2:329, 2:332-3, 2:336, 2:342; 2:346; 2:355, 2:3983:23; 3:24; 3:26; 3:27; 3:30, 3:38; 3:135, 3:146, 3:147, 3:174",,,,,,,,,,,,,,,,,,,,,,,"colleagues,family,Family & Friends of George Eliot,friends,George Eliot's colleagues,George Eliot's friends,George Eliot's relations,George Eliot's Social Network,relationship map,relationship web,Social Network",https://georgeeliotarchive.org/files/original/34c7ba999eecd9b46348e8f429ac8319.jpg,Portrait,"George Eliot's Social Network",1,0
2645,https://georgeeliotarchive.org/items/show/2645,"Parkes, Joseph (1796-1865)",,"A lawyer, Parkes was the father of George Eliot's close friend, Bessie Parkes. Parkes funded Eliot's translation of <i>Das Leben Jesu</i> and was furious when Eliot went to Germany with George Henry Lewes.",,,"<em>George Eliot Archive</em><span>, edited by Beverley Park Rilett, https://GeorgeEliotArchive.org</span>",,,,,,,,,,,,,,,,,,,,,,,,,,,"colleagues,family,Family & Friends of George Eliot,friends,George Eliot's colleagues,George Eliot's friends,George Eliot's relations,George Eliot's Social Network,relationship map,relationship web,Social Network",https://georgeeliotarchive.org/files/original/b94b0ad8ce0e7e2711b1bb03253b0d62.png,Portrait,"George Eliot's Social Network",1,0
2644,https://georgeeliotarchive.org/items/show/2644,"Parkes, Elizabeth ""Bessie"" Rayner (1829-1924)",,"After George Eliot moved to London to start her career in publishing in 1851, Bessie Parkes formed a close friendship with her that would last until Eliot's death. Parkes was a feminist author, editor, and campaigner who lobbied for better education and employment opportunities for women and with Barbara Leigh Smith Bodichon (another close friend of Eliot's), Parkes successfully petitioned for the passing of the Married Women's Property Act of 1870. Parkes claimed she was one of the few friends Eliot informed prior to her momentous trip to Germany with Lewes in 1854, and the two traded letters during the months Eliot was away. Parkes saw little of Eliot in the mid-1850s and on, but they still wrote to each other and spoke of their close friendship; an invitation to Parkes to come for lunch was among Eliot's last letters. At the age of 38, Parkes married a Frenchman named Louis Belloc and moved to Algiers, France with him. The couple had two children before Louis died suddenly in 1872, after only 5 years of marriage. Their children, Marie Belloc Lowndes (1868-1947) and Hilaire Belloc (1870-1953), went on to become renowned writers.",,,"<em>George Eliot Archive</em><span>, edited by Beverley Park Rilett, https://GeorgeEliotArchive.org</span>",,,,"2:7, 2:26, 2:30, 2:32, 2:35, 2:44, 2:64, 2:74, 2:87, 2:89, 2:99, 2:100, 2:107, 2:108, 2:108, 2:109, 2:115, 2:128, 2:134, 2:135, 2:136, 2:138, 2:141, 2:143, 2:151, 2:163, 2:173, 2:195, 2:200, 2:231, 2:235, 2:365, 2:379, 2:384, 2:428, 2:431, 2:436, 2:495, 3:133, 4:44, 4:85, 4:86, 4:114, 4:114, 4:131, 4:146, 4:186, 4:196, 5:125, 5:336, 6:392, 7:87, 7:347, 8:46, 8:241, 8:307, 8:317 ",,,,,,,,,,,,,,,,,,,,,,,"colleagues,family,Family & Friends of George Eliot,friends,George Eliot's colleagues,George Eliot's friends,George Eliot's relations,George Eliot's Social Network,relationship map,relationship web,Social Network",https://georgeeliotarchive.org/files/original/46051b8c8b566ee69680449f1edf5104.png,Portrait,"George Eliot's Social Network",1,0
2643,https://georgeeliotarchive.org/items/show/2643,"Pattison, Mark (1813-1884)",,"Rector of Lincoln College in Oxford, Mark Pattison was a prominent intellectual figure. He and his wife, Emilia Frances Strong, were friends with both George Eliot and George Henry Lewes. Some biographical critics have seen parallels in Pattison's May-December marriage and the Casaubons' unhappy marriage in Eliot's novel, <i>Middlemarch: </i>Pattison wrote a book about a man named Isaac Casaubon and was 27 years older than his wife (the same age difference in <em>Middlemarch</em>).",,"<a href=""https://www-oxforddnb-com.libproxy.unl.edu/view/10.1093/ref:odnb/9780198614128.001.0001/odnb-9780198614128-e-1011872?rskey=Cxppx9&amp;result=2"" target=""_blank"" rel=""noopener"">https://www-oxforddnb-com.libproxy.unl.edu/view/10.1093/ref:odnb/9780198614128.001.0001/odnb-9780198614128-e-1011872?rskey=Cxppx9&amp;result=2</a>","<em>George Eliot Archive</em>, edited by Beverley Park Rilett, https://GeorgeEliotArchive.org",,,,"6:202, 6:204, 6:243 

letters to wife: 5:38, 5:52, 5:65, 5:74, 5:77, 5:92, 5:95, 5:98, 5:116, 5:120, 5:141, 5:151, 5:215, 5:246, 5:304, 5:343, 5:371, 5:408, 5:460, 6:12, 6:66, 6:97, 6:107, 6:156, 6:176, 6:228, 6:342, 6:377, 7:90, 7:104, 7:154, 8:457 ",,,,,,,,,,,,,,,,,,,,,,,"colleagues,family,Family & Friends of George Eliot,friends,George Eliot's colleagues,George Eliot's friends,George Eliot's relations,George Eliot's Social Network,relationship map,relationship web,Social Network",https://georgeeliotarchive.org/files/original/de845c27e10b2e7189de625fabd78046.png,Portrait,"George Eliot's Social Network",1,0
2642,https://georgeeliotarchive.org/items/show/2642,"Pigott, Edward Frederik Smyth (1824-1895)",,"<span>Edward Frederick Smyth Pigott</span> was a journalist and theater critic and longtime friend of George Henry Lewes. In 1851, Pigott bought the <i>Leader, </i>which Lewes and Thornton Leigh Hunt had founded, and became one of its editors. Until Lewes's death in 1878, the two remained friends. Pigott visited Sunday afternoons at the Priory and met George Eliot there.",,"<a href=""https://www.npg.org.uk/collections/search/portrait/mw258215/Edward-Frederick-Smyth-Pigott-Men-of-the-Day-No-456?LinkID=mp97612&amp;role=sit&amp;rNo=1"" target=""_blank"" rel=""noopener"">https://www.npg.org.uk/collections/search/portrait/mw258215/Edward-Frederick-Smyth-Pigott-Men-of-the-Day-No-456?LinkID=mp97612&amp;role=sit&amp;rNo=1</a>","<em>George Eliot Archive</em>, edited by Beverley Park Rilett, https://GeorgeEliotArchive.org",,,,"2:395, 8:161, 8:206, 8:207, 8:209, 8:228, 8:233, 8:234, 8:243, 8:251, 8:254, 8:320, 8:374",,,,,,,,,,,,,,,,,,,,,,,"colleagues,family,Family & Friends of George Eliot,friends,George Eliot's colleagues,George Eliot's friends,George Eliot's relations,George Eliot's Social Network,relationship map,relationship web,Social Network",https://georgeeliotarchive.org/files/original/a654907483cf2fb5c8d2cc423457281f.png,Portrait,"George Eliot's Social Network",1,0
2641,https://georgeeliotarchive.org/items/show/2641,"Ponsonby, Mary Elizabeth (1832-1916)",,"Mary Elizabeth Posonby was the wife of Henry Frederick Ponsonby, who was the private secretary to Queen Victoria. Mary was one of the founding members of the committee of Girton College, and she also aided in organizing the first Trade Union for Women.",,"<a href=""https://www.npg.org.uk/collections/search/portrait/mw66957/Mary-Elizabeth-Grey-ne-Ponsonby-Countess-Grey?LinkID=mp63631&amp;role=sit&amp;rNo=3"" target=""_blank"" rel=""noopener"">https://www.npg.org.uk/collections/search/portrait/mw66957/Mary-Elizabeth-Grey-ne-Ponsonby-Countess-Grey?LinkID=mp63631&amp;role=sit&amp;rNo=3</a>","<em>George Eliot Archive</em><span>, edited by Beverley Park Rilett, https://GeorgeEliotArchive.org</span>",,,,"6:97, 6:120, 6:124, 6:166, 6:406, 7:110, 7:231 ",,,,,,,,,,,,,,,,,,,,,,,"colleagues,family,Family & Friends of George Eliot,friends,George Eliot's colleagues,George Eliot's friends,George Eliot's relations,George Eliot's Social Network,relationship map,relationship web,Social Network",https://georgeeliotarchive.org/files/original/f879a2e7773ead5974c3ff8e4d130a1b.png,Portrait,"George Eliot's Social Network",1,0
2640,https://georgeeliotarchive.org/items/show/2640,"Ritchie, Anne Isabella (1837-1919)",,"Born Anne Isabella Thackeray, she became Lady Richmond Ritchie upon marriage. Ritchie wrote biographies, memoirs, and novels.",,"<a href=""https://www-oxforddnb-com.libproxy.unl.edu/view/10.1093/ref:odnb/9780198614128.001.0001/odnb-9780198614128-e-1011546?rskey=dzJzuY&amp;result=2"" target=""_blank"" rel=""noopener"">https://www-oxforddnb-com.libproxy.unl.edu/view/10.1093/ref:odnb/9780198614128.001.0001/odnb-9780198614128-e-1011546?rskey=dzJzuY&amp;result=2</a>","<em>George Eliot Archive</em><span>, edited by Beverley Park Rilett, https://GeorgeEliotArchive.org</span>",,,,"7:284 ",,,,,,,,,,,,,,,,,,,,,,,"colleagues,family,Family & Friends of George Eliot,friends,George Eliot's colleagues,George Eliot's friends,George Eliot's relations,George Eliot's Social Network,relationship map,relationship web,Social Network",https://georgeeliotarchive.org/files/original/1f48e7119c65be3e8183c55ab9c46405.png,Portrait,"George Eliot's Social Network",1,0
2639,https://georgeeliotarchive.org/items/show/2639,"Senior, Jane Elizabeth (1828-1877)",,"Jane Elizabeth Senior was the first female inspector of workhouses and pauper schools in Britain and worked for the Red Cross during the Franco-Prussian War. She met George Eliot in 1866 and is believed by some scholars to be a source of inspiration for the character of Dorothea Brooke in <em>Middlemarch</em>. These critics point to Dorothea and Senior’s shared attraction to public service and the correspondence between Senior and Eliot during the time the novel was written, which includes reference to clothing and angels, symbols used in <em>Middlemarch</em> as well.",,"<a href=""https://en.wikipedia.org/wiki/Jane_Senior"" target=""_blank"" rel=""noopener"">https://en.wikipedia.org/wiki/Jane_Senior</a>","<em>George Eliot Archive</em><span>, edited by Beverley Park Rilett, https://GeorgeEliotArchive.org</span>",,,,"4:317, 4:365, 4:422, 5:55, 5:57, 5:82, 5:285, 5:372, 6:46, 6:269 ",,,,,,,,,,,,,,,,,,,,,,,"colleagues,family,Family & Friends of George Eliot,friends,George Eliot's colleagues,George Eliot's friends,George Eliot's relations,George Eliot's Social Network,relationship map,relationship web,Social Network",https://georgeeliotarchive.org/files/original/7423ecfa92b82defca861f64800dccd6.png,Portrait,"George Eliot's Social Network",1,0
2638,https://georgeeliotarchive.org/items/show/2638,"Sibree, John (1795-1877)",,"John Sibree was a Coventry clergyman, friend, and correspondent of George Eliot. His daughter was Mary Sibree, whom Eliot tutored in German, and his son was John Jr., who shared George Eliot's intellectual curiosity, especially regarding religious subjects. He also taught Eliot some Greek. The Sibree family were among Eliot's first acquaintances when she moved to Foleshill with her father in 1841. John Jr. encouraged Eliot to express lively, radical, even vehement views on race, revolution, royalty, and the arts. <br />Sibree came to abandon the ministry after Eliot's challenge to express his religious faith, finding that he could not. <br />Mary Sibree married John Cash, a Coventry weaver, ribbon supplier, and friend of Charles Bray who purchased Rosehill, the Brays' home, after Charles was forced into bankruptcy.",,"<a href=""https://en.wikipedia.org/wiki/File:Group_portrait_of_James_Sibree_and_family_ca_1901.jpg"" target=""_blank"" rel=""noopener"">https://en.wikipedia.org/wiki/File:Group_portrait_of_James_Sibree_and_family_ca_1901.jpg</a>","<em>George Eliot Archive</em>, edited by Beverley Park Rilett, https://GeorgeEliotArchive.org",,,,,,,,,,,,,,,,,,,,,,,,,,,"colleagues,family,Family & Friends of George Eliot,friends,George Eliot's colleagues,George Eliot's friends,George Eliot's relations,George Eliot's Social Network,relationship map,relationship web,Social Network","https://georgeeliotarchive.org/files/original/8a6985fb197bb6a9db60690a19b19d75.png,https://georgeeliotarchive.org/files/original/de535bae2e00bbe518915b8736a64f4b.jpg",Portrait,"George Eliot's Social Network",1,0
2637,https://georgeeliotarchive.org/items/show/2637,"Sidgwick, Henry (1838-1900)",,"A member of George Henry Lewes's circle of intellectuals, Henry Sidgwick was one of George Eliot’s favorite philosophers. Sidgwick was involved in various movements for women's education and taught at Cambridge for many years. With Sidgwick's encouragement, Eliot established the George Henry Lewes Studentship in Physiology at Cambridge, which Sidgwick served as a trustee on. Sidgwick was married to Eleanor Mildred Sidgwick.",,"<a href=""https://www-oxforddnb-com.libproxy.unl.edu/view/10.1093/ref:odnb/9780198614128.001.0001/odnb-9780198614128-e-1001263#odnb-9780198614128-e-1001263-mediaGroup-1"" target=""_blank"" rel=""noopener"">https://www-oxforddnb-com.libproxy.unl.edu/view/10.1093/ref:odnb/9780198614128.001.0001/odnb-9780198614128-e-1001263#odnb-9780198614128-e-1001263-mediaGroup-1</a>","<em>George Eliot Archive</em>, edited by Beverley Park Rilett, https://GeorgeEliotArchive.org",,,,,,,,,,,,,,,,,,,,,,,,,,,"colleagues,family,Family & Friends of George Eliot,friends,George Eliot's colleagues,George Eliot's friends,George Eliot's relations,George Eliot's Social Network,relationship map,relationship web,Social Network",https://georgeeliotarchive.org/files/original/b6176f2d73868a6ba7c8b6b3bf980df4.png,Portrait,"George Eliot's Social Network",1,0
2636,https://georgeeliotarchive.org/items/show/2636,"Simcox, Edith (1844-1901)",,"Edith Simcox was a lesbian and early feminist who struck up a close friendship with George Eliot that fueled Simcox's writings and community contributions. Simcox's excellent review of <em>Middlemarch</em> for the <em>Academy</em> in 1873 led her to meet the author. Simcox wrote extensively about her unrequited romantic love for Eliot in her personal journal <i>Autobiography of a Shirtmaker. </i>After the death of George Henry Lewes, Simcox considered herself a rival with John Cross for Eliot's affections and foresaw with jealous insight the marriage of Eliot to John Cross in 1880.<br /><br />Professionally, Simcox was a journalist who published reviews as H. Lawrenny; she also opened a women's shirt-making operative, was an active trade unionist, and was elected to the London School Board following community members' urgings that she serve.<i>&nbsp;</i>in 1881, Edith Simcox published a memorial tribute to Eliot in <i><em>Nineteenth Century.</em></i>",,,"<em>George Eliot Archive</em>, edited by Beverley Park Rilett, https://GeorgeEliotArchive.org",,,,,,,,,,,,,,,,,,,,,,,,,,,"colleagues,family,Family & Friends of George Eliot,friends,George Eliot's colleagues,George Eliot's friends,George Eliot's relations,George Eliot's Social Network,relationship map,relationship web,Social Network",https://georgeeliotarchive.org/files/original/117a193b517e415e4c970fb80e9bcb56.png,Portrait,"George Eliot's Social Network",1,0
2635,https://georgeeliotarchive.org/items/show/2635,"Simpson, George ",,"A clerk of John Blackwood's, George Simpson ran the Edinburgh office for the Blackwood's starting in 1846. He corresponded with George Eliot and George Henry Lewes on behalf of the publisher.",,,"<em>George Eliot Archive</em>, edited by Beverley Park Rilett, https://GeorgeEliotArchive.org",,,,"3:193, 3:200, 3:204, 3:209, 4:254, 4:253, 4:439, 4:443, 4:444, 4:317, 4:365, 4:422, 4:487, 6:30, 6:39, 6:42, 6:58, 6:197 ",,,,,,,,,,,,,,,,,,,,,,,"colleagues,family,Family & Friends of George Eliot,friends,George Eliot's colleagues,George Eliot's friends,George Eliot's relations,George Eliot's Social Network,relationship map,relationship web,Social Network",https://georgeeliotarchive.org/files/original/d0ae9113438fe5db5716ebd1787abc06.png,Portrait,"George Eliot's Social Network",1,0
